,제목,링크
0,국내여행코스 울릉도 여행 둘째날 버스투어 A코스 관광,https://blog.naver.com/piil/223596761973
1,국내여행 무주 창고 대형 카페,https://blog.naver.com/dorothy_bet/223591417000
2,10월 국내여행 가볼만한곳 충남 공주 부여 백제문화제,https://blog.naver.com/sm011sm/223603389561
3,[국내여행] 나홀로 목포_해상케이블카 시간 팁!,https://blog.naver.com/sssel_123/223609239066
4,영주 반띵관광택시 로이쿠 지원할인 받아 국내여행 가볼만한곳,https://blog.naver.com/lemon8363/223582041842
5,롤리키드 캐리어 가격 착한 국내 여행가방,https://blog.naver.com/lim265/223570345206
6,자산가를 위한 첫 걸음 - 경매 국내여행 시작,https://blog.naver.com/realaroa/223558388651
